id,name,headline,location,tags,notes,url,email,phoneNumber,address,twitter1,twitter2,im1,im2,im3,website1,website2,website3
matheus-eler-064b711b4,Matheus Eler,Founder of Minuto Econômico.,"Vitória, ES",BEES - dados,,https://linkedin.com/in/matheus-eler-064b711b4,," ",,,,,,,,,
irineu-gomes-49786992,Irineu Gomes,Engenheiro de Dados | Analista de Dados,"Serra, ES",BEES - dados,,https://linkedin.com/in/irineu-gomes-49786992,," ",,,,,,,,,
rodrigoseidel,Rodrigo Seidel,Data Engineer,"Vitória, ES",BEES - dados,,https://linkedin.com/in/rodrigoseidel,," ",,,,,,,,,
juliana-rodrigues-de-lima-meirelles-8b1141230,Juliana Rodrigues de Lima Meirelles,Mestranda em Ciência da Informação,"Vila Velha, ES",BEES - dados,,https://linkedin.com/in/juliana-rodrigues-de-lima-meirelles-8b1141230,," ",,,,,,,,,
lourenco-ramos,Lourenço De Oliveira Pinto Ramos,Engenheiro de Dados no Banestes S/A – Banco do Estado do Espírito Santo,"Vila Velha, ES",BEES - dados,,https://linkedin.com/in/lourenco-ramos,," ",,,,,,,,,
gislaine-ramos,Gislaine Ramos,Estagiária de Inovação e Criatividade,"Vitória, ES",BEES - dados,,https://linkedin.com/in/gislaine-ramos,," ",,,,,,,,,
marcos-cruz-a742397,Marcos Cruz,Analista de Suporte a banco de dados at Banestes,"Vila Velha, ES",BEES - dados,,https://linkedin.com/in/marcos-cruz-a742397,," ",,,,,,,,,