id,name,headline,location,tags,notes,url,email,phoneNumber,address,twitter1,twitter2,im1,im2,im3,website1,website2,website3
gcisantos,Gustavo Campos Ignacio dos Santos,Mestrando em Ciência da Computação UFABC | Analista de BI Pleno | Cientista de Dados | Python,"Itaquaquecetuba, SP",USIM - dados,,https://linkedin.com/in/gcisantos,," ",,,,,,,,,
luiz-octávio-vergolino-de-mendonça-neto-40a54a165,Luiz Octávio Vergolino de Mendonça Neto,Data Protection | LGPD Analyst | CPC-PD | Usiminas,"Belo Horizonte, MG",USIM - dados,,https://linkedin.com/in/luiz-octávio-vergolino-de-mendonça-neto-40a54a165,," ",,,,,,,,,
ricardo-bianchini-4b5731112,Ricardo Bianchini,Ricardo Bianchini,"Ipatinga, MG",USIM - dados,,https://linkedin.com/in/ricardo-bianchini-4b5731112,," ",,,,,,,,,
wandersondiniz,Wanderson Martins Diniz,Analista de Rede e Comunicação de Dados na USIMINAS,"Ipatinga, MG",USIM - dados,,https://linkedin.com/in/wandersondiniz,," ",,,,,,,,,
daniele-almeida-71860731,Daniele Almeida,Senior Sql Server Database Administrator na Vetta,"Belo Horizonte, MG",USIM - dados,,https://linkedin.com/in/daniele-almeida-71860731,," ",,,,,,,,,